{
  "name": "Queue edits made offline and replay them on reconnect",
  "status": "current",
  "commits": [
    "https://github.com/example_owner/recipe-box/commit/e04c9b7"
  ],
  "notes": "Edits queue in IndexedDB. Needs a retry cap before it can ship.",
  "created": "2026-07-01T08:32:00Z",
  "updated": "2026-09-07T15:48:00Z"
}
